community,url,topic_cluster,repeated_pain,workaround,evidence,tool_or_process_replaced,user_sophistication,monetization_hint,category_maturity,notes,next_action
"anthropics/claude-code GitHub issues","https://github.com/anthropics/claude-code/issues","agent memory/context","Agents lose or mishandle project state across long-running work","Users create persistent memory files, custom instructions, hooks, and issue-search habits","Multiple issue threads discuss context, reliability, docs, usage, and workflow regressions","Manual project notes, human code review, ad hoc session handoffs","developer/prosumer","paid memory layer, workflow guardrails, team handoff tool","emerging","Seed example. Replace with specific issue URLs and quotes during a scan.","watch"
"Hacker News","https://news.ycombinator.com/item?id=46426624","agent memory/context","Agents lose context between sessions; users must re-explain project state; CLAUDE.md files exceed 250 lines causing compliance degradation","Local git-based systems with /handoff /sync /engineering commands; multiple markdown files (FEATURE_IMPL_PLAN.md + per-feature docs); global ~/.claude/CLAUDE.md at 15k tokens","wfn: maintains FEATURE_IMPL_PLAN.md + per-feature docs + CLAUDE.md under 250 lines; BonoboIO: 15k-token global ~/.claude/CLAUDE.md with conventions and custom slash commands; frumplestlatz: 'It just has to be local' (enterprise/privacy constraint)","External memory SaaS; cloud-based agent memory tools","developer/prosumer","Local-first memory management; git-backed session handoff tool","emerging","Strong skepticism toward cloud solutions; users prefer local markdown in git; enterprise/privacy constraint is common objection to cloud memory","interview users"
"Hacker News","https://news.ycombinator.com/item?id=47103237","agent memory/context","Context silently disappears during long sessions (compression amnesia); memory locked to one tool and one machine; no provenance tracking or conflict resolution","CLAUDE.md and Rules files (acknowledged as insufficient); starting sessions fresh after tool switches","Bumblebiber: 'long conversations get compressed and context silently disappears — the agent forgets decisions made 2 hours ago'; 'Switch from Claude Code to Cursor, or from your laptop to your desktop, and everything is gone'; YaraDori raises need for provenance tracking + audit trails","Per-session CLAUDE.md files; manual notes across tool switches","developer","Cross-tool portable memory; audit trail for agent decisions; conflict resolution for contradictory agent knowledge","emerging","YaraDori articulates enterprise-grade requirements (provenance, audit trails) — signals buyers beyond solo devs","interview users"
"Hacker News","https://news.ycombinator.com/item?id=46636707","agent memory/context","Must restart from scratch each session; response quality degrades as conversation lengthens; agent forgets to use memory without repeated nudges","Builder implemented hooks to keep prompting Claude to use memory; zettelkasten-style notes stored in ChromaDB","Builder quote: 'I spend hours with claude digging into some functionality, and it was frustrating that I have to start from scratch next day/session'; hooks-as-reminder is described as required to prevent agent from ignoring memory","Manual session summaries; re-explanation at session start","developer","Self-evolving knowledge graph; time-aware recall; hooks-based memory enforcement","emerging","Builder's own pain drove tool creation (A-MEM); hooks needed to remind Claude to use its own memory — reveals that even with memory tools, agents don't reliably use them","score"
"anthropics/claude-code GitHub issues","https://github.com/anthropics/claude-code/issues/4588","agent memory/context","Sub-agents are stateless; domain expertise must be re-explained in every Task invocation; no accumulation of specialized knowledge across sessions","Manually prepending critical instructions to every agent prompt (e.g. 'CRITICAL: Use Unicode escape sequences for Java properties')","Issue: 'Currently ui-translator requires this in every prompt: CRITICAL: Use Unicode escape sequences (\uXXXX) for Java properties'; closed as duplicate referencing 6+ related issues (#4182 #1770 #3013 #87 #1813 #3081)","Human expert hand-holding; repeated manual prompt engineering per task","developer","Agent-specific persistent memory files; cross-session specialization layer","emerging","Closed as duplicate = high volume of similar reports; 123k repo stars indicates large affected population; 6+ duplicate issues is strong signal","score"
"Hacker News","https://news.ycombinator.com/item?id=46126066","agent memory/context","Agent re-explores files already analyzed in prior sessions; 10+ minute task overhead from context rebuilding each session","Built local proxy intercepting API calls; captures reasoning; stores in SQLite; auto-injects relevant context matched by file","'I kept watching Claude Code spend 10 minutes re-exploring files it already analyzed yesterday'; task time reduced from 10-11 min to 1-2 min; ~250 npm downloads with no promotion; team synchronization dashboard built on top","Manual session summaries; keeping sessions alive continuously to avoid context loss","developer","Automatic context capture + injection; team knowledge sync; token efficiency through intelligent filtering","emerging","250 npm downloads without promotion is strong organic demand signal; quantified time savings (10-11 min → 1-2 min) is credible and specific","interview users"
"Cursor Community Forum","https://forum.cursor.com/t/agents-have-lost-access-to-memory-capability/143310","agent memory/context","Native memory feature broken for months then silently removed; users lose all project context built up across sessions","Convert memories to project rules; create project.md files; use OpenSpec framework for spec-driven development; downgrade to v2.0.77","Maor Azoulay: 'memories persistence has been broken for me for months'; 'instead of fixing it they remove the feature altogether'; Dean Rie (support): 'known recurring issue affecting multiple users'","Native Cursor memory feature; per-session re-explanation of project state","developer/prosumer","Reliable cross-session memory that survives product updates; portable memory not tied to one tool version","emerging","Feature removal drove users to manual workarounds — a durable-gap signal, not a temporary bug; structural unreliability erodes platform trust","interview users"
"DEV Community / Medium","https://dev.to/sammiihk/i-built-a-self-managing-memory-system-for-claude-code-and-it-changed-how-i-work-3208","agent memory/context","Session amnesia; hallucination from stale or missing context; hours of context re-establishment overhead per week","MEMORY.md as table-of-contents routing Claude to topic files; private-journal-mcp (engineering notebook + user-info notebook + search); claude-brain (1321 sessions, 67k+ messages, 9 projects); two-file injection: MEMORY.md ~130 lines + domain topic files","'I built a memory OS after Claude Code hallucinated 42% of my code'; 'It Saves Me Hours Every Week'; claude-brain: running across 1321 sessions and 67000+ messages; cluster of 5+ 'I built X for Claude Code memory' posts on DEV Community and Medium","Manual session notes; human context explanation at session start; repeated prompt engineering","developer","Managed memory service; session handoff automation; anti-hallucination memory layer","emerging","Cluster of 5+ builder posts = reproducible pain driving DIY behavior; 42% hallucination rate quantification is extreme and credible pain signal; claude-brain scale (67k messages) shows users investing significant effort","score"
